"title","url","date","host","hits","words","source"
"The silent health crisis facing Black men Over 40—and why it’s often caught too late - TheGrio","https://thegrio.com/2026/03/25/the-silent-health-crisis-facing-black-men-over-40-and-why-its-often-caught-too-late","2026-03-25","thegrio.com","2","1157","Thegrio"
"U.N. passes resolution declaring transatlantic slave trade 'the gravest crime against humanity,' but what does this mean for reparations? - TheGrio","https://thegrio.com/2026/03/25/u-n-to-vote-on-declaring-transatlantic-slave-trade-the-gravest-crime-against-humanity-but-what-does-this-mean-for-reparations","2026-03-25","thegrio.com","4","1104","Thegrio"
"Usher speaks out on Diddy, says mogul has been 'misrepresented' amid legal fallout - TheGrio","https://thegrio.com/2026/03/25/usher-defends-diddy-legacy-interview-comments","2026-03-25","thegrio.com","2","476","Thegrio"
"Who gets grace? Rachel Lindsay calls out the double standard in 'Bachelorette' scandal - TheGrio","https://thegrio.com/2026/03/25/who-gets-grace-rachel-lindsay-calls-out-the-double-standard-in-bachelorette-scandal","2026-03-25","thegrio.com","3","962","Thegrio"
"Kandi Burruss, Todd Tucker settle divorce with co-parenting agreement for their two children - TheGrio","https://thegrio.com/2026/03/26/kandi-burruss-todd-tucker-divorce-joint-custody","2026-03-26","thegrio.com","1","445","Thegrio"
"Loyola Chicago student paper apologizes for wording in fatal shooting coverage, sparks debate - TheGrio","https://thegrio.com/2026/03/26/loyola-phoenix-apology-illegal-immigrant-term-sheridan-gorman-case","2026-03-26","thegrio.com","1","410","Thegrio"
"Meagan Good and Tank join season 4 cast of 'Reasonable Doubt' - TheGrio","https://thegrio.com/2026/03/26/meagan-good-tank-reasonable-doubt-season-4-cast","2026-03-26","thegrio.com","1","329","Thegrio"
"Druski once again shows how Black comedy shapes the conversation - Andscape","https://andscape.com/features/druski-comedy-skit-conservative-women","2026-03-27","andscape.com","4","1678","Andscape"
"Duke men's basketball GM Rachel Baker has 'an impact on everything' for the Blue Devils - Andscape","https://andscape.com/features/duke-basketball-gm-rachel-baker-black-woman-trailblazer-rod-baker-college-ncaa","2026-03-27","andscape.com","3","5476","Andscape"
"How Nets Unite turns Barclays Center into a reflection of Brooklyn - Andscape","https://andscape.com/features/brooklyn-nets-womens-impact-night-brooklyn-unite","2026-03-27","andscape.com","4","1221","Andscape"
"When Kid Rock was 'Black' - Andscape","https://andscape.com/features/kid-rock-rap-origin-detroit-black-politics-race-genre-evolution-country","2026-03-27","andscape.com","3","1931","Andscape"
"Why Darius Acuff Jr. is the only bet Reebok Basketball could make - Andscape","https://andscape.com/features/darius-acuff-jr-reebok-signature-sneakers-release-arkansas-nba-draft-nil","2026-03-27","andscape.com","2","1424","Andscape"
"House Ethics Subcommittee Finds Rep. Cherfilus-McCormick Guilty of 25 Violations","https://ground.news/article/house-ethics-subcommittee-finds-rep-cherfilus-mccormick-guilty-of-25-violations_352c70","2026-03-27","ground.news","1","969","Ground News"
"Senate Unanimously Passes DHS Funding Bill Excluding ICE and Border Patrol, Moving to End Airport Crisis","https://ground.news/article/senate-unanimously-passes-dhs-funding-bill-excluding-ice-and-border-patrol-moving-to-end-airport-crisis_2db3b2","2026-03-27","ground.news","2","843","Ground News"
"Tiger Woods arrested at crash scene on suspicion of DUI, sheriff says","https://ground.news/article/tiger-woods-arrested-at-crash-scene-on-suspicion-of-dui-sheriff-says_b156e4","2026-03-27","ground.news","2","1033","Ground News"
"Trump signs executive action to pay TSA employees after Congress fails to agree on DHS funding","https://ground.news/article/trump-signs-executive-action-to-pay-tsa-employees-after-congress-fails-to-agree-on-dhs-funding","2026-03-27","ground.news","1","879","Ground News"
"Alaska's Coastal Ice Season Has Shrunk by Weeks, Study Finds","https://ground.news/article/alaskas-coastal-ice-season-has-shrunk-by-weeks-study-finds_0d37c8","2026-03-28","ground.news","1","811","Ground News"
"Border Patrol Agent Indicted for Strangling Handcuffed Detainee","https://ground.news/article/border-patrol-agent-accused-of-strangling-handcuffed-man-in-dona-ana-county","2026-03-28","ground.news","1","853","Ground News"
"House rejects Senate DHS deal, passes short-term funding patch","https://ground.news/article/house-rejects-senate-dhs-deal-passes-short-term-funding-patch","2026-03-28","ground.news","1","907","Ground News"
"JD Vance says he was 'obsessed' with UFOs, believes aliens are actually 'demons'","https://ground.news/article/jd-vance-says-he-was-obsessed-with-ufos-believes-aliens-are-actually-demons","2026-03-28","ground.news","1","815","Ground News"
"Kentucky Family Rejects $26 Million Bid to Sell Farm Land for Data Center","https://ground.news/article/kentucky-family-rejects-26-million-bid-to-sell-farm-land-for-data-center_4f2f20","2026-03-28","ground.news","3","835","Ground News"
"Maine Urges Federal Judge to Dismiss DOJ’s Lawsuit for Voter Registration Data","https://ground.news/article/federal-judge-to-consider-maine-challenge-to-doj-voter-data-lawsuit","2026-03-28","ground.news","1","758","Ground News"
"Millions rally across the US in anti-Trump 'No Kings' protests","https://ground.news/article/millions-rally-across-the-us-in-anti-trump-no-kings-protests_a8ec53","2026-03-28","ground.news","1","834","Ground News"
"Navy shipyard workers approve a contract deal with Bath Iron Works, ending weeklong strike","https://ground.news/article/biw-says-it-has-reached-tentative-agreement-with-union-workers-on-new-contract","2026-03-28","ground.news","1","1208","Ground News"
"UFC to Host Mixed Martial Arts Event on White House Lawn for Trump’s 80th Birthday","https://ground.news/article/im-concerned-about-the-white-house-fight-joe-rogan-raises-major-concerns-about-white-house-ufc-card-and-its-impact-on-fighters","2026-03-28","ground.news","1","1017","Ground News"
"'Epstein Island' replaces White House name on Android, Google blames fake Maps edit","https://ground.news/article/post-reporters-called-the-white-house-some-saw-epstein-island-on-the-screen","2026-03-29","ground.news","2","713","Ground News"
"Artists, Celebrities Protest Outside Kennedy Center Against Trump Takeover","https://ground.news/article/big-name-artists-musicians-journalists-gather-in-support-of-free-speech-at-kennedy-center_ef1726","2026-03-29","ground.news","2","1103","Ground News"
"California leads push to add key vitamin to corn tortillas, aimed at reducing Latino birth defects","https://ground.news/article/california-leads-push-to-add-key-vitamin-to-corn-tortillas-aimed-at-reducing-latino-birth-defects","2026-03-29","ground.news","2","841","Ground News"
"DHS funding lapse is now the longest government shutdown in U.S. history","https://ground.news/article/dhs-funding-lapse-is-now-the-longest-government-shutdown-in-us-history","2026-03-29","ground.news","2","1047","Ground News"
"FBI director pushes to release investigative files on Rep. Eric Swalwell: Reports","https://ground.news/article/kash-patels-push-against-democratic-lawmaker-raises-concerns-within-fbi","2026-03-29","ground.news","1","830","Ground News"
"Former Joe Biden Security Staffer Arrested in Fatal San Francisco Shooting","https://ground.news/article/ex-biden-staffer-who-posed-for-kamala-harris-pic-busted-in-grisly-san-francisco-slaying","2026-03-29","ground.news","1","820","Ground News"
"House discharge petition on TPS for Haiti secures enough signatures to force vote","https://ground.news/article/effort-to-force-house-vote-to-save-haitians-tps-secures-bipartisan-support","2026-03-29","ground.news","1","801","Ground News"
"Iran-Backed Handala Hacks and Circulates FBI Director Patel's Emails","https://ground.news/article/1db0cfab-38f3-4cfd-9859-9013413b73a2","2026-03-29","ground.news","1","718","Ground News"
"Italian Researcher Claims Second Sphinx Lies Buried Beneath Giza Plateau","https://ground.news/article/italian-research-claims-second-sphinx-lies-buried-beneath-giza-plateau_9060bb","2026-03-29","ground.news","3","831","Ground News"
"Musk joined Trump and Modi call on Iran, says New York Times","https://ground.news/article/guest-on-call-about-us-iran-conflict-elon-musk-joined-pm-modi-donald-trump-call-says-report","2026-03-29","ground.news","1","857","Ground News"
"Palestine Action supporters arrested as London’s Met Police reverse policy","https://ground.news/article/palestine-action-supporters-arrested-as-londons-met-police-reverse-policy_b73976","2026-03-29","ground.news","1","744","Ground News"
"Pentagon preparing for weeks of ground operations in Iran, Washington Post reports","https://ground.news/article/pentagon-preparing-for-weeks-of-ground-operations-in-iran-washington-post-reports_ce3658","2026-03-29","ground.news","1","841","Ground News"
"Rob Schneider calls for US to ‘restore military draft for our nation’s young people’ amid Iran war","https://ground.news/article/rob-schneider-calls-to-restore-the-military-draft-in-the-us-amid-war-with-iran","2026-03-29","ground.news","2","780","Ground News"
"Tehran Times Warns US Troops 'Welcome to Hell' as Pentagon Weighs Ground Deployment","https://ground.news/article/tehran-times-warns-us-troops-welcome-to-hell-as-pentagon-weighs-ground-deployment_808976","2026-03-29","ground.news","1","790","Ground News"
"U.S. sailors, Marines deployed amid Iran war reach Centcom region","https://ground.news/article/uss-tripoli-embarked-31st-marine-expeditionary-unit-arrive-in-middle-east_bb7267","2026-03-29","ground.news","1","921","Ground News"
"US carrier Ford arrives in Croatia for repairs","https://ground.news/article/aircraft-carrier-uss-gerald-r-ford-arrives-in-croatia-for-repairs_737ae9","2026-03-29","ground.news","1","775","Ground News"
"US lawmakers say they’ll visit Taiwan before Trump’s summit with China’s Xi","https://ground.news/article/us-lawmakers-say-theyll-visit-taiwan-before-trumps-summit-with-chinas-xi_9d962b","2026-03-29","ground.news","3","1090","Ground News"
"VP Vance wins CPAC straw poll for 2028 GOP presidential nod","https://ground.news/article/vance-or-rubio-cpac-debates-a-republican-party-after-trump_4a77b6","2026-03-29","ground.news","1","839","Ground News"
"“Damn the Novel!” An author’s cry against a privileged genre","https://myafricanmagazine.com/damn-the-novel-an-authors-cry-against-a-privileged-genre-27","2026-03-26","myafricanmagazine.com","4","1549","Myafricanmagazine"
"Probably the biggest “No Kings” protest this Saturday","https://myafricanmagazine.com/probably-the-biggest-no-kings-protest-this-saturday","2026-03-27","myafricanmagazine.com","4","853","Myafricanmagazine"
"DOJ Used ICE Memo To Justify Immigration Court Arrests","https://newsone.com/6854190/doj-used-ice-memo-justify-immigration-court-arrests","2026-03-26","newsone.com","3","871","Newsone"
"Donald Trump Exists In His Own Version Of Reality","https://newsone.com/6854199/donald-trump-exists-his-own-version-reality","2026-03-26","newsone.com","4","1202","Newsone"
"Paapa Essiedu On Death Threats Over His Harry Potter Casting","https://newsone.com/6854171/paapa-essiedu-harry-potter-snape-death-threats","2026-03-26","newsone.com","3","1100","Newsone"
"US Votes Against Labeling Slavery 'Gravest Crime Against Humanity'","https://newsone.com/6854191/us-votes-against-un-resolution-labeling-slavery-crime-against-humanity","2026-03-26","newsone.com","3","884","Newsone"
"Aliyah Henderson Pleads Not Guilty To Murdering 2 Daugthers","https://newsone.com/6854281/aliyah-henderson-pleads-not-guilty-murdering-daughters","2026-03-27","newsone.com","3","936","Newsone"
"Breonna Taylor: Mother Speaks Out On Officer's Dropped Charges","https://newsone.com/6854259/breonna-taylor-mother-speaks-out-officer-charges-dropped","2026-03-27","newsone.com","3","891","Newsone"
"Delusional White Conservatives Predictably Big Mad At Druski","https://newsone.com/6854258/delusional-white-conservatives-predictably-big-mad-druski","2026-03-27","newsone.com","4","838","Newsone"
"Kash Patel Personal Emails Exposed By Hackers Linked To Iran","https://newsone.com/6854345/kash-patel-hacked-emails-exposed-iranian-hackers","2026-03-27","newsone.com","3","870","Newsone"
"Senate Votes To Partially Fund DHS, Bill Must Pass In House","https://newsone.com/6854283/senate-votes-to-partially-fund-dhs-unclear-if-house-will-vote-to-end-shutdown","2026-03-27","newsone.com","3","933","Newsone"
"The Las Vegas 'Spades' Is A Bad Idea For An NBA Team Name","https://newsone.com/6854270/las-vegas-spades-bad-idea-nba-team-name","2026-03-27","newsone.com","5","1376","Newsone"
"The Merchant's House Museum Under Threat Of Construction","https://newsone.com/6854291/the-merchants-house-museum-underground-railroad-under-threat","2026-03-27","newsone.com","3","1196","Newsone"
"The United States Is Crumbling. Bring the ‘DEIs’ Back","https://newsone.com/6854276/united-states-crumbling-bring-back-dei","2026-03-27","newsone.com","5","1341","Newsone"
"They Found A Klan Hood Inside A Mississippi Police Office","https://newsone.com/6854315/of-course-they-found-klan-hood-mississippi-police-office","2026-03-27","newsone.com","5","1818","Newsone"
"Trump Disparages Minnesota Somali Community In Bigoted Rant","https://newsone.com/6854213/trump-disparages-minnesota-somali-community-bigoted-rant","2026-03-27","newsone.com","3","897","Newsone"
"Economists Warn Iran War Increases Risk Of Recession","https://newsone.com/6854376/economists-warn-iran-war-increases-recession-risk","2026-03-28","newsone.com","3","902","Newsone"
"Pete Hegseth Removes 2 Black Officers From Promotion List","https://newsone.com/6854379/pete-hegseth-removes-black-officers-from-promotion-list","2026-03-28","newsone.com","4","863","Newsone"
"Trump's Signature Will Appear On US Paper Currency. But Why?","https://newsone.com/6854286/donald-trump-signature-us-paper-currency","2026-03-28","newsone.com","3","1094","Newsone"
"'The Ms. Pat Show' becomes first BET+ show to get renewed for Paramount Plus - TheGrio","https://thegrio.com/2026/03/27/the-ms-pat-show-renewed-paramount-plus","2026-03-27","thegrio.com","4","476","Thegrio"
"'Watson' starring Morris Chestnut and 'DMV' starring Tim Meadows canceled at CBS - TheGrio","https://thegrio.com/2026/03/27/watson-dmv-canceled-cbs-morris-chestnut-tim-meadows","2026-03-27","thegrio.com","3","450","Thegrio"
"A look at Brandy and Whitney Houston’s enduring bond through the years - TheGrio","https://thegrio.com/2026/03/27/brandy-whitney-houston-enduring-bond-through-the-years","2026-03-27","thegrio.com","3","932","Thegrio"
"Alaina Hoskins started over at 54—now she’s bottling affirmation for women of all ages - TheGrio","https://thegrio.com/2026/03/27/alaina-hoskins-started-over-at-54-now-shes-bottling-affirmation-for-women-of-all-ages","2026-03-27","thegrio.com","2","1138","Thegrio"
"Black farmers shut out of Trump White House farmers event: 'Why can't we be at the table?' - TheGrio","https://thegrio.com/2026/03/27/black-farmers-shut-out-of-trump-white-house-farmers-event-why-cant-we-be-at-the-table","2026-03-27","thegrio.com","4","739","Thegrio"
"Colman Domingo to make ‘SNL’ hosting debut as April lineup revealed - TheGrio","https://thegrio.com/2026/03/27/colman-domingo-snl-host-april-2026","2026-03-27","thegrio.com","2","401","Thegrio"
"Florida Rep. Sheila Cherfilus-McCormick faces disciplinary action after House Ethics panel’s 25 violations ruling - TheGrio","https://thegrio.com/2026/03/27/sheila-cherfilus-mccormick-ethics-guilty-fema-funds-case","2026-03-27","thegrio.com","1","465","Thegrio"
"Hegseth removes Black Army officers from overwhelmingly white promotion list - TheGrio","https://thegrio.com/2026/03/27/hegseth-removes-black-army-officers-from-overwhelmingly-white-promotion-list","2026-03-27","thegrio.com","3","1025","Thegrio"
"Tiger Woods arrested following rollover crash in Florida days after first golf competition since 2024 - TheGrio","https://thegrio.com/2026/03/27/tiger-woods-arrested-dui-florida","2026-03-27","thegrio.com","1","484","Thegrio"
"Trump signs executive order targeting 'DEI discrimination' in federal contracting - TheGrio","https://thegrio.com/2026/03/27/trump-signs-executive-order-targeting-dei-discrimination-in-federal-contracting","2026-03-27","thegrio.com","3","778","Thegrio"
"Tyler Perry blocked from giving cash to unpaid TSA agents at Atlanta's airport - TheGrio","https://thegrio.com/2026/03/27/tyler-perry-unpaid-tsa-agents-donation-blocked","2026-03-27","thegrio.com","2","508","Thegrio"
"Why Black professionals are walking away from corporate America — and not looking back - TheGrio","https://thegrio.com/2026/03/27/why-black-professionals-are-walking-away-from-corporate-america-and-not-looking-back","2026-03-27","thegrio.com","3","993","Thegrio"
"Why Druski’s 'conservative white woman' skit has everyone talking - TheGrio","https://thegrio.com/2026/03/27/why-druskis-conservative-white-woman-skit-has-everyone-talking","2026-03-27","thegrio.com","3","903","Thegrio"
"'Every day is a blessing': Former NBA player Lamar Odom reflects on 2015 coma and how Kobe Bryant inspires his sobriety - TheGrio","https://thegrio.com/2026/03/28/lamar-odom-reflects-coma-kobe-bryant-soberity","2026-03-28","thegrio.com","1","643","Thegrio"
"'Snowfall' spinoff sees Mykelti Williamson, Brandon Mychal Smith join cast alongside Isaiah John, Gain Bean and Asante Blackk - TheGrio","https://thegrio.com/2026/03/28/snowfall-spinoff-adds-mykelti-williamson-others-to-cast","2026-03-28","thegrio.com","2","461","Thegrio"
"Atlanta man accused of stealing Beyoncé's music during 'Cowboy Carter' tour rejects plea deal: 'Ready to go to trial' - TheGrio","https://thegrio.com/2026/03/27/atlanta-man-rejects-plea-deal-beyonce-theft","2026-03-28","thegrio.com","1","376","Thegrio"
"Ava DuVernay’s advice to an aspiring filmmaker: A reality check","https://thegrio.com/2026/03/28/ava-duvernay-filmmaking-advice-diy","2026-03-28","thegrio.com","3","564","Thegrio"
"Breaking barriers and building bridges: Dr. Chelsey Green is harmonizing education and industry at the Recording Academy - TheGrio","https://thegrio.com/2026/03/28/dr-chelsey-green-recording-academy-chair-music-education","2026-03-28","thegrio.com","4","640","Thegrio"
"Chilli of TLC reportedly donated to Donald Trump's 2024 campaign as rumors tying her to MAGA influencers grow - TheGrio","https://thegrio.com/2026/03/28/rozanda-chilli-thomas-donated-donald-trump-maga-accusations","2026-03-28","thegrio.com","3","441","Thegrio"
"Denied paying TSA agents cash, Tyler Perry found a loophole to gift officers working without pay in Atlanta - TheGrio","https://thegrio.com/2026/03/28/tyler-perry-donates-gift-cards-tsa","2026-03-28","thegrio.com","1","456","Thegrio"
"Jill Scott honors HBCU culture in upcycled ‘Patched Gal’ look at inaugural Aware Fest - TheGrio","https://thegrio.com/2026/03/28/jill-scott-hbcu-aware-fest-atlanta-fashion","2026-03-28","thegrio.com","3","534","Thegrio"
"Mayor Brandon Scott Slams Digital Racism & Redefines ""DEI""","https://thegrio.com/2026/03/28/brandon-scott-instagram-racism-response","2026-03-28","thegrio.com","4","934","Thegrio"
"Megan Thee Stallion rescues dog from kill shelter hours before euthanasia","https://thegrio.com/2026/03/28/megan-thee-stallion-rescues-dog-kill-shelter","2026-03-28","thegrio.com","1","564","Thegrio"
"Kerry Washington says she started couples therapy 'preventatively' with Nnamdi Asomugha 'before anything was wrong' - TheGrio","https://thegrio.com/2026/03/29/kerry-washington-says-she-started-couples-therapy-preventatively-with-nnamdi-asomugha-before-anything-was-wrong","2026-03-29","thegrio.com","2","519","Thegrio"
"TLC's Chilli denies she is MAGA after donations were made public: 'I did not read the fine print' - TheGrio","https://thegrio.com/2026/03/29/tlcs-chilli-denies-she-is-maga-after-donations-were-made-public-i-did-not-read-the-fine-print","2026-03-29","thegrio.com","2","575","Thegrio"
"In NCAA athletics, student-athletes are often choosing deal over degree - Andscape","https://andscape.com/features/in-ncaa-athletics-student-athletes-are-often-choosing-deal-over-degree","2026-03-30","andscape.com","2","1924","Andscape"
"UConn's Tarris Reed Jr. elevates his game en route to Final Four - Andscape","https://andscape.com/features/uconn-basketball-tarris-reed-jr-duke-ncaa-tournament-furman-final-four","2026-03-30","andscape.com","2","1222","Andscape"
"Assessing AI powered price forecasting tools in currency markets - AI News","https://www.artificialintelligence-news.com/news/assessing-ai-powered-price-forecasting-tools-in-currency-markets","2026-03-30","www.artificialintelligence-news.com","2","2468","Artificialintelligence News"
"Glia wins Excellence Award for safer AI in banking - AI News","https://www.artificialintelligence-news.com/news/glia-wins-excellence-award-for-safer-ai-in-banking","2026-03-30","www.artificialintelligence-news.com","2","2154","Artificialintelligence News"
"How AEO vs GEO reshapes AI-driven brand discovery in 2026 - AI News","https://www.artificialintelligence-news.com/news/how-aeo-vs-geo-reshapes-ai-driven-brand-discovery-in-2026","2026-03-30","www.artificialintelligence-news.com","2","2571","Artificialintelligence News"
"JPMorgan begins tracking how employees use AI at work","https://www.artificialintelligence-news.com/news/jpmorgan-begins-tracking-how-employees-use-ai-at-work","2026-03-30","www.artificialintelligence-news.com","3","2304","Artificialintelligence News"
"Kong names Bruce Felt as chief financial officer - AI News","https://www.artificialintelligence-news.com/news/kong-names-bruce-felt-as-chief-financial-officer","2026-03-30","www.artificialintelligence-news.com","3","1938","Artificialintelligence News"
"Secure governance accelerates financial AI revenue growth","https://www.artificialintelligence-news.com/news/secure-governance-accelerates-financial-ai-revenue-growth","2026-03-30","www.artificialintelligence-news.com","5","3465","Artificialintelligence News"
"Tiger Woods arrested at crash scene on suspicion of DUI, sheriff says","https://ground.news/article/tiger-woods-arrested-at-crash-scene-on-suspicion-of-dui-sheriff-says_f044b9","2026-03-27","ground.news","1","884","Ground News"
"IDF Drops over 80 Explosives on Tehran Weapon Production Sites in Latest Strike","https://ground.news/article/iranian-military-infrastructure-struck-in-tehran-says-idf","2026-03-29","ground.news","1","637","Ground News"
"Pentagon preparing for weeks of ground operations in Iran, Washington Post reports","https://ground.news/article/pentagon-preparing-for-weeks-of-ground-operations-in-iran-washington-post-reports_02ae78","2026-03-29","ground.news","2","901","Ground News"
"Amnesty Warns of Human Rights Concerns Ahead of 2026 World Cup","https://ground.news/article/amnesty-warns-2026-world-cup-across-north-american-risks-becoming-stage-for-repression","2026-03-30","ground.news","2","898","Ground News"
"An Israeli soldier from Connecticut is killed in southern Lebanon weeks after completing training","https://ground.news/article/an-israeli-soldier-from-connecticut-is-killed-in-southern-lebanon-weeks-after-completing-training_77f5cc","2026-03-30","ground.news","1","902","Ground News"
"Chesney the kangaroo scales tall fence and flees petting zoo for three days on the lam","https://ground.news/article/chesney-the-kangaroo-scales-tall-fence-and-flees-petting-zoo-for-three-days-on-the-lam_4224d6","2026-03-30","ground.news","1","748","Ground News"
"Iran's Heavy Water Production Plant No Longer Operational, IAEA Says","https://ground.news/article/irans-heavy-water-production-plant-no-longer-operational-iaea-says_711298","2026-03-30","ground.news","1","746","Ground News"
"Kosovo approves troops to Gaza under US-backed scheme","https://ground.news/article/tiny-european-nation-to-send-troops-to-gaza-under-peace-plan","2026-03-30","ground.news","2","546","Ground News"
"LAPD issues dispersal order after dozens arrested at “No Kings” protest in downtown Los Angeles","https://ground.news/article/no-kings-rallies-sweep-us-los-angeles-sees-tear-gas-dispersal-orders-and-arrests","2026-03-30","ground.news","1","834","Ground News"
"Most say Trump administration has not done enough to ‘Make America Healthy Again’: Survey","https://ground.news/article/nearly-half-of-maha-voters-dont-think-trump-has-done-enough-new-poll-shows","2026-03-30","ground.news","1","796","Ground News"
"Police used AI facial recognition to arrest a Tennessee woman for crimes committed in a state she says she’s never visited","https://ground.news/article/police-used-ai-facial-recognition-to-arrest-a-tennessee-woman-for-crimes-committed-in-a-state-she-says-shes-never-visited","2026-03-30","ground.news","2","848","Ground News"
"Serbia’s Ruling Party Claims Clean Sweep in Tense Local Elections","https://ground.news/article/serbias-ruling-party-claims-clean-sweep-in-tense-local-elections","2026-03-30","ground.news","1","854","Ground News"
"Somaliland Offers to Extradite Rep. Ilhan Omar After Vance Fraud Claim","https://ground.news/article/somaliland-offers-to-extradite-rep-ilhan-omar-after-vance-fraud-claim","2026-03-30","ground.news","1","754","Ground News"
"Spain says it has closed its airspace to US planes involved in Iran war","https://ground.news/article/spain-closes-airspace-to-us-planes-involved-in-iran-war-el-pais-says_bcaea6","2026-03-30","ground.news","1","764","Ground News"
"Sysco to buy Jetro Restaurant Depot in $29 billion deal","https://ground.news/article/sysco-to-buy-jetro-restaurant-depot-in-29-billion-deal","2026-03-30","ground.news","1","696","Ground News"
