"title","url","date","host","hits","words","source"
"“Damn the Novel!” An author’s cry against a privileged genre","https://myafricanmagazine.com/damn-the-novel-an-authors-cry-against-a-privileged-genre-18/?utm_source=rss&utm_medium=rss&utm_campaign=damn-the-novel-an-authors-cry-against-a-privileged-genre-18","2026-01-21","myafricanmagazine.com","4","1810","Myafricanmagazine"
"Thousands flock to Ouidah, Benin, to celebrate Vodun Days","https://myafricanmagazine.com/thousands-flock-to-ouidah-benin-to-celebrate-vodun-days/?utm_source=rss&utm_medium=rss&utm_campaign=thousands-flock-to-ouidah-benin-to-celebrate-vodun-days","2026-01-23","myafricanmagazine.com","4","1551","Myafricanmagazine"
"The 75-Country Visa Freeze Is Also A Hit On HBCUs","https://newsone.com/6784080/75-country-visa-freeze-also-hit-hbcus/","2026-01-20","newsone.com","5","1719","Newsone"
"Judge Won’t Block Policy Limiting Congress’s Ability To Oversee ICE","https://newsone.com/6784338/judge-wont-block-policy-limiting-congress-ability-oversee-ice/","2026-01-20","newsone.com","4","1010","Newsone"
"What The Trump Admin’s ‘Milk Bill’ Means For Black Children","https://newsone.com/6783807/what-trump-admin-milk-bill-means-for-black-children/","2026-01-20","newsone.com","5","1811","Newsone"
"What Part Of 'What Would Jesus Do' Involves Being An ICE Agent?","https://newsone.com/6783906/what-part-of-what-would-jesus-do-involves-being-an-ice-agent/","2026-01-20","newsone.com","4","1385","Newsone"
"ICE Agents Force Elderly US Citizen Outside In His Underwear","https://newsone.com/6784150/ice-agents-force-elderly-us-citizen-outside-underwear/","2026-01-21","newsone.com","4","1196","Newsone"
"DOJ Accuses Minnesota Democrats Of Obstructing ICE","https://newsone.com/6784250/doj-accuses-minnesota-democrats-obstructing-ice/","2026-01-21","newsone.com","4","1179","Newsone"
"Trump Pick Lindsey Halligan Out As Interim US Attorney","https://newsone.com/6786331/trump-pick-lindsey-halligan-out-interim-us-attorney/","2026-01-21","newsone.com","4","1333","Newsone"
"After Trump's Attacks On DEI, Where Do We Go From Here?","https://newsone.com/6786170/after-trump-attacks-dei-where-we-go-from-here/","2026-01-21","newsone.com","4","1939","Newsone"
"Youngest Living Freedom Rider Receives Formal Apology","https://newsone.com/6785990/youngest-living-freedom-rider-receives-formal-apology/","2026-01-21","newsone.com","4","1081","Newsone"
"ICE Opens Fire In Los Angeles, Law Enforcement Scrambles","https://newsone.com/6786555/ice-opens-fire-los-angeles-law-enforcement-scrambles/","2026-01-21","newsone.com","4","1266","Newsone"
"Can White People Join The Black Panther Party?","https://newsone.com/6786384/can-white-people-join-black-panther-party/","2026-01-21","newsone.com","4","1934","Newsone"
"ICE Racially Profiling Civilians And Off-Duty Cops Of Color","https://newsone.com/6785952/ice-racially-profiling-civilians-off-duty-cops-of-color/","2026-01-21","newsone.com","4","1385","Newsone"
"ICE Snatches Up 5-Year-Old To Use As 'Bait' To Arrest Father","https://newsone.com/6788726/ice-snatches-up-5-year-old-to-use-as-bait-to-arrest-father/","2026-01-22","newsone.com","4","1126","Newsone"
"ICE Crackdown In Maine Called 'Operation Catch Of The Day'","https://newsone.com/6788928/ice-crackdown-maine-called-operation-catch-of-the-day/","2026-01-22","newsone.com","4","1544","Newsone"
"Supreme Court Appears Inclined To Let Lisa Cook Keep Her Job","https://newsone.com/6788570/supreme-court-appears-inclined-let-lisa-cook-keep-her-job/","2026-01-22","newsone.com","4","1071","Newsone"
"Judge Orders New York To Begin Redistricting Process","https://newsone.com/6788939/judge-orders-new-york-begin-redistricting-process/","2026-01-22","newsone.com","4","1146","Newsone"
"REPRESENT: The Next 100 Years Of Black History Month","https://newsone.com/6783625/represent-the-next-100-years-black-history-month/","2026-01-22","newsone.com","4","1043","Newsone"
"Maryland Redistricting Map Removes State’s 1 Republican Seat","https://newsone.com/6786732/maryland-redistricting-map-removes-states-republican-seat/","2026-01-22","newsone.com","4","1124","Newsone"
"Minnesota Stages Economic Blackout To Protest ICE","https://newsone.com/6791422/minneosta-stages-economic-blackout-protest-ice/","2026-01-23","newsone.com","4","1053","Newsone"
"History Tells Us Big 'Sinners' Oscar Wins Are Not Guaranteed","https://newsone.com/6791340/history-tells-us-big-sinners-oscar-wins-not-guaranteed/","2026-01-23","newsone.com","4","1532","Newsone"
"JD Vance Denies ICE Racial Profiling, Blames Victims","https://newsone.com/6791277/jd-vance-denies-ice-racial-profiling-blames-victims/","2026-01-23","newsone.com","4","1509","Newsone"
"DOJ Arrests Black Woman Organizer Of Anti-ICE Church Protest","https://newsone.com/6789141/doj-arrests-black-woman-organizer-anti-ice-church-protest/","2026-01-23","newsone.com","4","1128","Newsone"
"Black Voting Rights And The Impact Of Louisiana v Callais","https://newsone.com/6791102/black-voting-rights-impact-louisiana-v-callais/","2026-01-23","newsone.com","4","1577","Newsone"
"Former Iowa Education Official Pleads Guilty To Fed Charges","https://newsone.com/6791542/former-iowa-education-official-pleads-guilty-fed-charges/","2026-01-24","newsone.com","4","1145","Newsone"
"Raheem Howard: Baton Rouge Cop Had No Warrant To Search Car","https://newsone.com/6791555/raheem-howard-baton-rouge-cop-no-warrant-search-car/","2026-01-24","newsone.com","4","1247","Newsone"
"‘Real Housewives of Salt Lake City' star Mary Cosby reveals where she stands after her son’s arrest: ‘I have to step back so that he can learn’ - TheGrio","https://thegrio.com/2026/01/22/real-housewife-of-salt-lake-city-star-mary-cosby-reveals-where-she-stands-after-her-sons-arrest-i-have-to-step-back-so-that-he-can-learn/","2026-01-22","thegrio.com","2","632","Thegrio"
"Ruth E. Carter makes Oscar history as the most-nominated Black woman ever - TheGrio","https://thegrio.com/2026/01/23/ruth-e-carter-most-nominated-black-woman-oscar-history/","2026-01-23","thegrio.com","3","631","Thegrio"
"Dallas man exonerated 70 years after his wrongful execution - TheGrio","https://thegrio.com/2026/01/23/dallas-man-exonerated-70-years-after-his-wrongful-execution/","2026-01-23","thegrio.com","2","806","Thegrio"
"'I'm just following orders,' slavery exhibits stripped from Philadelphia historical site following Trump executive order - TheGrio","https://thegrio.com/2026/01/23/philadelphia-sues-trump-slavery-exhibits-removed-presidents-house/","2026-01-23","thegrio.com","3","801","Thegrio"
"David Crowley seeks unconventional path to potentionally become Wisconsin’s first Black governor - TheGrio","https://thegrio.com/2026/01/23/david-crowley-wisconsin-first-black-governor-election/","2026-01-23","thegrio.com","3","1086","Thegrio"
"Erin Jackson reflects on being the first Black woman to win gold in an individual event during the Winter Olympics: ‘I was struggling with some feelings of imposter syndrome’ - TheGrio","https://thegrio.com/2026/01/23/erin-jackson-winter-olympics-imposter-syndrome/","2026-01-23","thegrio.com","3","570","Thegrio"
"Breakout band The Paradox lands first #1 on the Billboard charts - TheGrio","https://thegrio.com/2026/01/23/breakout-band-the-paradox-lands-first-1-on-the-billboard-charts/","2026-01-23","thegrio.com","1","493","Thegrio"
"'She has added so much to my days': Deion Sanders heaps praise on Karreuche Tran as NFL legend confirms they're a couple - TheGrio","https://thegrio.com/2026/01/23/deion-sanders-talks-relationship-with-karreuche-tran/","2026-01-23","thegrio.com","1","433","Thegrio"
"Michael B. Jordan’s first call after receiving Oscar nomination was to his mom: ‘The woman who started it all’ - TheGrio","https://thegrio.com/2026/01/23/michael-b-jordans-first-call-after-receiving-oscar-nomination-was-to-his-mom-the-woman-who-started-it-all/","2026-01-23","thegrio.com","1","635","Thegrio"
"A Georgia lawmaker has introduced a bill to make lemon pepper the official state wing flavor - TheGrio","https://thegrio.com/2026/01/22/a-georgia-lawmaker-has-introduced-a-bill-to-make-lemon-pepper-the-official-state-wing-flavor/","2026-01-23","thegrio.com","3","478","Thegrio"
"Black lawmakers and scholars' comparison of ICE to slave patrols isn't as far-fetched as you may think - TheGrio","https://thegrio.com/2026/01/23/jasmine-crockett-jelani-cobb-ice-modern-day-slave-patrols/","2026-01-23","thegrio.com","2","844","Thegrio"
"Ron Funches shares autism diagnosis after feeling ‘isolated’ and ‘misunderstood’ on ‘The Traitors’: 'I honestly didn’t know' - TheGrio","https://thegrio.com/2026/01/23/ron-funches-shares-autism-diagnosis-after-feeling-isolated-and-misunderstood-on-the-traitors-i-honestly-didnt-know/","2026-01-23","thegrio.com","2","793","Thegrio"
"Huey P. Newton’s niece defends support for Trump amid threat of lawsuit against Black Panther Party chapter - TheGrio","https://thegrio.com/2026/01/23/huey-p-newtons-niece-defends-support-for-trump-amid-threat-of-lawsuit-against-black-panther-party-chapter/","2026-01-23","thegrio.com","2","815","Thegrio"
"Regina King is exploring new ways to connect with her late son Ian through wine, and an unexpected link to the Obamas - TheGrio","https://thegrio.com/2026/01/23/regina-king-is-exploring-new-ways-to-connect-with-her-late-son-ian-through-wine-and-an-unexpected-link-to-the-obamas/","2026-01-23","thegrio.com","1","699","Thegrio"
"Teyana Taylor speaks out after receiving first Oscar nomination: ‘I am emotional. I am humbled’ - TheGrio","https://thegrio.com/2026/01/23/teyana-taylor-speaks-out-after-receiving-first-oscar-nomination-i-am-emotional-i-am-humbled/","2026-01-23","thegrio.com","1","819","Thegrio"
"Djimon Hounsou's ex-girlfriend released from jail after being arrested for assaulting him - TheGrio","https://thegrio.com/2026/01/22/djimon-hounsous-ex-girlfriend-released-from-jail-after-being-arrested-for-assaulting-him/","2026-01-23","thegrio.com","2","478","Thegrio"
"Kamala Harris wants you to be 'outraged' by the ICE detainment of 5-year-old Liam Ramos - TheGrio","https://thegrio.com/2026/01/23/kamala-harris-liam-ramos-ice/","2026-01-23","thegrio.com","2","660","Thegrio"
"Timbaland collabs with Babybel to produce “Mini Wax Tracks” - TheGrio","https://thegrio.com/2026/01/23/timbaland-babybel-mini-wax-tracks/","2026-01-23","thegrio.com","5","1470","Thegrio"
"Naomi Osaka responds to critics of her viral jellyfish outfit: ‘I do this for the people that are like me’ - TheGrio","https://thegrio.com/2026/01/23/naomi-osaka-responds-to-critics-of-her-viral-jellyfish-outfit-i-do-this-for-the-people-that-are-like-me/","2026-01-23","thegrio.com","3","577","Thegrio"
"White House's fake image of Black activist's arrest with altered darker skin, tears slammed as 'propaganda' - TheGrio","https://thegrio.com/2026/01/23/white-houses-fake-image-nekima-levy-armstrong-arrest-photo/","2026-01-23","thegrio.com","2","709","Thegrio"
"'Our voices matter': Jamila T. Davis says her work is not done after Survivors Justice Act is signed into law in New Jersey - TheGrio","https://thegrio.com/2026/01/23/dr-jamila-t-davis-survivors-justice-act-law-new-jersey/","2026-01-23","thegrio.com","2","853","Thegrio"
"Sherrone Moore proclaims innocence in court hearing, wants stalking and home invasion charges dropped - TheGrio","https://thegrio.com/2026/01/23/sherrone-moore-proclaims-innocence-ex-michigan-coach/","2026-01-24","thegrio.com","3","555","Thegrio"
"'Fraudulent conduct': Pharrell Williams sued by Neptunes partner Chad Hugo amid messy split - TheGrio","https://thegrio.com/2026/01/24/chad-hugo-sues-pharrell-williams-the-neptunes-split/","2026-01-24","thegrio.com","1","590","Thegrio"
"'Having to stop here breaks my heart': Naomi Osaka withdraws from Australian Open due to injury - TheGrio","https://thegrio.com/2026/01/24/naomi-osaka-withdraws-australian-open-injury/","2026-01-24","thegrio.com","1","495","Thegrio"
"Hulu acquires rights to Amy DuBois Barnett's 'If I Ruled The World' for planned hour-long drama series - TheGrio","https://thegrio.com/2026/01/23/hulu-if-ruled-the-world-amy-dubois-barnett/","2026-01-24","thegrio.com","4","465","Thegrio"
"Pam Grier's Story of Witnessing Lynching Draws Criticism Online","https://www.theroot.com/pam-grier-says-she-saw-lynched-bodies-and-the-internet-2000085897","2026-01-23","www.theroot.com","3","712","Theroot"
"Why Black Stars Are Walking Away From All-White Work Environments","https://www.theroot.com/from-karamo-brown-to-garcelle-beauvais-why-black-stars-2000085554","2026-01-23","www.theroot.com","4","1344","Theroot"
"Black Texas Teen Exonerated 70 Years After His Execution","https://www.theroot.com/black-texas-teen-i-finally-i-exonerated-70-years-lat-2000085898","2026-01-23","www.theroot.com","4","799","Theroot"
"These Stylish MuuMuus Are Not to Be Missed","https://www.theroot.com/these-aint-your-grandmas-muumuus-1849762035","2026-01-23","www.theroot.com","2","883","Theroot"
"Cam'ron Argument With Ex Gets Internet Divided","https://www.theroot.com/camron-told-his-ex-on-air-that-she-was-a-bad-investment-2000085894","2026-01-23","www.theroot.com","3","793","Theroot"
"The Story of Vanessa Williams, The Controversial First Black Miss America","https://www.theroot.com/how-vanessa-williams-the-first-black-woman-to-win-miss-2000059966","2026-01-23","www.theroot.com","5","3071","Theroot"
"Black Films, Documentaries at Sundance 2026","https://www.theroot.com/whats-black-at-sundance-2026-movies-documentaries-and-2000080684","2026-01-23","www.theroot.com","4","2278","Theroot"
"Black Singers Going on Tour in 2026","https://www.theroot.com/the-most-exciting-tours-from-black-artists-in-2026-2000085980","2026-01-23","www.theroot.com","4","2256","Theroot"
"KKK Law Being Used to Silence Two Black Women in Minneapolis","https://www.theroot.com/civil-rights-lawyer-how-a-kkk-law-is-being-used-to-sil-2000085907","2026-01-23","www.theroot.com","2","971","Theroot"
"Athletes More Successful Than Their Professional Athlete Fathers!","https://www.theroot.com/athletes-who-became-more-successful-than-their-professi-2000086026","2026-01-23","www.theroot.com","4","1201","Theroot"
