"title","url","date","host","hits","words","source"
"Video Shows ICE Agents Lied About Shooting Of Venezuelan Man","https://newsone.com/6855193/ice-agents-lied-shooting-minneapolis-video","2026-04-06","newsone.com","3","1507","Newsone"
"A House Fire Taught Me About Who Gets To Rebuild In America","https://newsone.com/6855302/family-house-fire-revealed-who-gets-rebuild-america","2026-04-07","newsone.com","4","1227","Newsone"
"Freedom Table: Pushing Back Against Voter Suppression","https://newsone.com/6855307/freedom-table-pushing-back-against-voter-suppression","2026-04-07","newsone.com","3","837","Newsone"
"Jake Paul Wants To Do A Blackface Skit In Response To Druski","https://newsone.com/6855229/jake-paul-blackface-skit-response-druski","2026-04-07","newsone.com","2","1246","Newsone"
"Trump Threatens Iran With Genocide In Latest Off-Script Rant","https://newsone.com/6855308/trump-threatens-iran-genocide-latest-rant","2026-04-07","newsone.com","2","1338","Newsone"
"Who's Afraid Of The 25th Amendment? Trump Should Be.","https://newsone.com/6855219/25th-amendment-donald-trump-iran","2026-04-07","newsone.com","2","943","Newsone"
"Black midwives file landmark lawsuit against Georgia over some of the nation's most restrictive birth laws - TheGrio","https://thegrio.com/2026/04/06/black-midwives-file-landmark-lawsuit-against-georgia-over-some-of-the-nations-most-restrictive-birth-laws","2026-04-06","thegrio.com","3","1031","Thegrio"
"Eight shows a week, little support: Amber Riley questions Broadway’s status quo - TheGrio","https://thegrio.com/2026/04/06/eight-shows-a-week-little-support-amber-riley-questions-broadways-status-quo","2026-04-06","thegrio.com","4","1275","Thegrio"
"Misty Copeland is finding empowerment through perimenopause - TheGrio","https://thegrio.com/2026/04/06/misty-copeland-grace-respecting-changes-perimenopause","2026-04-06","thegrio.com","2","564","Thegrio"
"Noah Lyles and Junelle Bromfield tie the knot in epic ceremony celebrating the Black diaspora - TheGrio","https://thegrio.com/2026/04/06/noah-lyles-junelle-bromfield-wedding-ceremony-celebrating-black-diaspora","2026-04-06","thegrio.com","4","743","Thegrio"
"Terry Crews' wife, Rebecca, shares long fight with Parkinson’s and new hope after breakthrough treatment - TheGrio","https://thegrio.com/2026/04/06/terry-crews-shares-wife-rebeccas-long-fight-with-parkinsons-and-new-hope-after-breakthrough-treatment","2026-04-06","thegrio.com","1","493","Thegrio"
"Trump says God approves of US war in Iran, doubles down on threat to 'decimate' country - TheGrio","https://thegrio.com/2026/04/06/trump-says-god-approves-of-us-war-in-iran-threat-to-decimate-country","2026-04-06","thegrio.com","3","924","Thegrio"
"WNBA star Angel Reese traded to Atlanta Dream - TheGrio","https://thegrio.com/2026/04/06/angel-reese-trade-atlanta-dream-chicago-sky","2026-04-06","thegrio.com","1","494","Thegrio"
"‘Comics Unleashed with Byron Allen’ to replace the ‘Late Show’ on CBS - TheGrio","https://thegrio.com/2026/04/06/comics-unleashed-with-byron-allen-to-replace-the-late-show","2026-04-06","thegrio.com","1","379","Thegrio"
"Cardi B says scammers allegedly ran up $60K on her credit card: 'Y'all going to jail!' - TheGrio","https://thegrio.com/2026/04/07/cardi-b-credit-card-fraud-60k-scam","2026-04-07","thegrio.com","1","421","Thegrio"
"Fuel surge drives new shipping fees as Amazon, UPS, and FedEx raise costs - TheGrio","https://thegrio.com/2026/04/07/fuel-surcharges-amazon-ups-fedex-shipping-costs","2026-04-07","thegrio.com","2","434","Thegrio"
"Halle Bailey calls out Hollywood’s ‘unfair’ standards for Black films: ‘It shouldn’t be like that’ - TheGrio","https://thegrio.com/2026/04/07/halle-bailey-calls-out-hollywoods-unfair-standards-for-black-films-it-shouldnt-be-like-that","2026-04-07","thegrio.com","2","849","Thegrio"
"Janai Norman confirms abrupt departure from ‘Good Morning America’: 'I hoped that we’d have more time' - TheGrio","https://thegrio.com/2026/04/07/janai-norman-exits-good-morning-america-after-contract-ends-calls-departure-cut-short","2026-04-07","thegrio.com","2","457","Thegrio"
"Offset hospitalized after shooting incident outside Florida casino - TheGrio","https://thegrio.com/2026/04/06/offset-shot-florida-hospitalized-stable","2026-04-07","thegrio.com","2","394","Thegrio"
"President Trump sends grim message to Iran: 'A whole civilization will die tonight' - TheGrio","https://thegrio.com/2026/04/07/trump-grim-message-to-iran-a-whole-civilization-will-die-tonight","2026-04-07","thegrio.com","3","622","Thegrio"
"UK bars Ye from entry over past anti-semitic remarks, forcing cancellation of major London music festival - TheGrio","https://thegrio.com/2026/04/07/uk-bars-ye-from-entry-over-past-anti-semitic-remarks-forcing-cancellation-of-major-london-music-festival","2026-04-07","thegrio.com","1","331","Thegrio"
"Atlanta Dream trade a perfect fit for Angel Reese’s game and growing star power - Andscape","https://andscape.com/features/angel-reese-atlanta-dream-chicago-sky-trade-analysis-wnba-rivalry","2026-04-08","andscape.com","3","1262","Andscape"
"Cleveland Cavaliers guard James Harden is ‘here for a reason’ - Andscape","https://andscape.com/features/cleveland-cavaliers-guard-james-harden-is-here-for-a-reason","2026-04-08","andscape.com","2","1271","Andscape"
"AI workflows for software developers and the need for oversight","https://www.artificialintelligence-news.com/news/ai-workflows-developer-success-and-central-project-management-needs","2026-04-08","www.artificialintelligence-news.com","2","2896","Artificialintelligence News"
"Microsoft open-source toolkit secures AI agents at runtime","https://www.artificialintelligence-news.com/news/microsoft-open-source-toolkit-secures-ai-agents-at-runtime","2026-04-08","www.artificialintelligence-news.com","2","2735","Artificialintelligence News"
"Iran foreign minister says passage through the Strait of Hormuz allowed next 2 weeks under Iranian military management","https://ground.news/article/iran-foreign-minister-says-passage-through-the-strait-of-hormuz-allowed-next-2-weeks-under-iranian-military-management_8b0140","2026-04-07","ground.news","3","870","Ground News"
"Amsterdam Researchers Build Metamaterials that Learn to Change Shape","https://ground.news/article/amsterdam-researchers-build-metamaterials-that-learn-to-change-shape","2026-04-08","ground.news","2","570","Ground News"
"Arizona Bills Target Mobile Home Utility Fees, Abandonment Rules","https://ground.news/article/mobile-home-legislation-in-arizona-target-utility-costs-abandonment-rules-and-manager-training_c72405","2026-04-08","ground.news","1","524","Ground News"
"Carney, European leaders welcome reported Iran-U.S. ceasefire in joint statement","https://ground.news/article/carney-european-leaders-welcome-reported-iran-us-ceasefire-in-joint-statement","2026-04-08","ground.news","1","660","Ground News"
"Delta Cuts Growth Plans as Fuel Costs Rise; Refinery Adds $300 Million","https://ground.news/article/delta-cuts-growth-plans-as-fuel-costs-rise-refinery-adds-300-million","2026-04-08","ground.news","1","716","Ground News"
"Democratic-backed Chris Taylor wins Wisconsin Supreme Court race, growing liberal majority","https://ground.news/article/democratic-backed-chris-taylor-wins-wisconsin-supreme-court-race-growing-liberal-majority_f613c6","2026-04-08","ground.news","1","683","Ground News"
"Former FedEx driver pleads guilty to killing 7-year-old girl after making delivery at her Texas home","https://ground.news/article/former-fedex-driver-pleads-guilty-to-killing-7-year-old-girl-after-making-delivery-at-her-texas-home_c9a883","2026-04-08","ground.news","1","736","Ground News"
"General Motors Recalls over 270,000 Cars in US over Rearview Camera Issue","https://ground.news/article/gm-recalling-more-than-270-000-chevrolet-malibu-vehicles-in-us-due-to-rearview-camera-screen-issue","2026-04-08","ground.news","2","711","Ground News"
"Gilgo Beach serial killings suspect Rex Heuermann pleads guilty to 7 murders and admits to killing another","https://ground.news/article/8f0ec24f-9e2e-4507-ba1a-8d249c785bf7","2026-04-08","ground.news","1","725","Ground News"
"Hegseth Declares Victory in War on Iran After Ceasefire Deal","https://ground.news/article/hegseth-declares-victory-in-war-on-iran-after-ceasefire-deal_d39492","2026-04-08","ground.news","2","793","Ground News"
"High school principal shot in leg after confronting man with a gun, Oklahoma sheriff says","https://ground.news/article/principal-injured-in-shooting-at-oklahoma-high-school-officials-confirm","2026-04-08","ground.news","1","890","Ground News"
"Iran says it is halting oil tanker traffic through Strait of Hormuz after Israel strikes Lebanon","https://ground.news/article/iran-says-it-is-halting-oil-tanker-traffic-through-strait-of-hormuz-after-israel-strikes-lebanon_94a898","2026-04-08","ground.news","1","798","Ground News"
"Israel has agreed to the terms of the two-week US-Iran ceasefire agreement, White House official says","https://ground.news/article/israel-has-agreed-to-the-terms-of-the-two-week-us-iran-ceasefire-agreement-white-house-official-says_4bc9bd","2026-04-08","ground.news","2","804","Ground News"
"Matthew Perry's Stepmother Says 'Ketamine Queen' Should Get Maximum Sentence","https://ground.news/article/the-ketamin-queen-will-be-sentenced-for-matthew-perrys-death-in-los-angeles","2026-04-08","ground.news","1","804","Ground News"
"Meta debuts new AI model, attempting to catch Google, OpenAI after spending billions","https://ground.news/article/meta-debuts-new-ai-model-attempting-to-catch-google-openai-after-spending-billions","2026-04-08","ground.news","2","723","Ground News"
"Missouri Enacts Law Allowing Divorces During Pregnancy","https://ground.news/article/missouri-governor-signs-bill-banning-judges-from-delaying-divorces-when-a-spouse-is-pregnant","2026-04-08","ground.news","1","904","Ground News"
"NASA Confirms Daytime Fireball Over Northeast, Visible in Five States","https://ground.news/article/fireball-spotted-in-pennsylvania-new-jersey-delaware-traveled-at-30-000-mph-before-disintegrating-nasa-says","2026-04-08","ground.news","1","729","Ground News"
"New Paper Urges Therapists to Screen Patients for AI Chatbot Use","https://ground.news/article/new-paper-urges-therapists-to-screen-patients-for-ai-chatbot-use","2026-04-08","ground.news","3","701","Ground News"
"Officer improperly canceled visa of Harvard scholar charged with frog embryo smuggling, judge rules","https://ground.news/article/officer-improperly-canceled-visa-of-harvard-scholar-charged-with-frog-embryo-smuggling-judge-rules","2026-04-08","ground.news","1","841","Ground News"
"Oil tumbles below $100 after Trump announces two-week ceasefire","https://ground.news/article/oil-tumbles-below-100-after-trump-announces-two-week-ceasefire_afe7c7","2026-04-08","ground.news","2","997","Ground News"
"Rep. Eric Swalwell vows to push back on ICE in bid for California governor","https://ground.news/article/rep-eric-swalwell-vows-to-push-back-on-ice-in-bid-for-california-governor","2026-04-08","ground.news","1","828","Ground News"
"Republican Clay Fuller wins special election for Marjorie Taylor Greene’s old seat in Congress","https://ground.news/article/republican-clay-fuller-wins-special-election-for-marjorie-taylor-greenes-old-seat-in-congress","2026-04-08","ground.news","1","757","Ground News"
"Traders place large $950 million bet on oil price falling hours ahead of ceasefire: Report","https://ground.news/article/traders-place-large-950-million-bet-on-oil-price-falling-hours-ahead-of-ceasefire","2026-04-08","ground.news","1","724","Ground News"
"Trial to begin in lawsuit over fatal Los Angeles police shooting of 14-year-old girl in 2021","https://ground.news/article/trial-to-begin-in-lawsuit-over-fatal-los-angeles-police-shooting-of-14-year-old-girl-in-2021","2026-04-08","ground.news","1","601","Ground News"
"Trump announces 50% tariffs on nations supplying Iran with weapons","https://ground.news/article/trump-announces-50-tariffs-on-nations-supplying-iran-with-weapons_655b89","2026-04-08","ground.news","1","790","Ground News"
"Trump says there will be ‘no enrichment’ of uranium in Iran, we’ll dig out ‘nuclear dust’","https://ground.news/article/93fbc0a5-0861-4a47-a51f-fe1f69d22d15","2026-04-08","ground.news","2","686","Ground News"
"Trump Says U.S. Will Help Clear Strait of Hormuz Backlog After Truce","https://ground.news/article/trump-says-us-will-help-with-traffic-buildup-in-strait-of-hormuz_948dbf","2026-04-08","ground.news","2","873","Ground News"
"Trump will pursue stability with China's Xi in May meeting, USTR Greer says","https://ground.news/article/trump-will-pursue-stability-with-chinas-xi-in-may-meeting-ustr-greer-says","2026-04-08","ground.news","2","719","Ground News"
"Vance Says Trump Is 'Impatient' as Iran Ceasefire Holds","https://ground.news/article/vance-says-trump-is-impatient-about-progress-on-iran","2026-04-08","ground.news","2","908","Ground News"
"Bayou Barbie Angel Reese Is Headed To The Atlanta Dream","https://newsone.com/6855382/angel-reese-joins-atlanta-dream-wnba","2026-04-07","newsone.com","4","2268","Newsone"
"Florida Law Allows Student Groups To Be Labeled Terrorists","https://newsone.com/6855398/ron-desantis-florida-law-student-groups-labeled-terrorists","2026-04-07","newsone.com","3","855","Newsone"
"How Universities Are Quietly Killing Black Student Life","https://newsone.com/6855369/universities-quietly-killing-black-student-life","2026-04-07","newsone.com","2","1986","Newsone"
"Mizzou Pulls Funding From Black Student Organizations","https://newsone.com/6855335/mizzou-pulls-funding-from-black-student-organizations","2026-04-07","newsone.com","2","1073","Newsone"
"Trump Wants To Privatize TSA, And So Did Project 2025","https://newsone.com/6855352/trump-suggests-privatize-tsa-project-2025","2026-04-07","newsone.com","2","818","Newsone"
"Judge Blocks Trump Admin Request For College Admissions Data","https://newsone.com/6855448/judge-blocks-trump-admin-request-college-admission-data","2026-04-08","newsone.com","2","880","Newsone"
"Pete Hegseth Compares Pilot Rescue To Resurrection Of Jesus","https://newsone.com/6855389/pete-hegseth-compares-pilot-rescue-resurrection-esus-christ","2026-04-08","newsone.com","3","1007","Newsone"
"Trump Announces Ceasefire With Iran, Denies The US Caved","https://newsone.com/6855428/trump-announces-ceasefire-with-iran-denies-he-caved","2026-04-08","newsone.com","2","1649","Newsone"
"Trump Is Unhinged, But The 25th Amendment Won't Save Us","https://newsone.com/6855392/trump-unhinged-25th-amendment-wont-save-us","2026-04-08","newsone.com","4","1787","Newsone"
"22-year-old Carie Everett made history as Miss North Carolina—now her death points to a growing cancer crisis in young people - TheGrio","https://thegrio.com/2026/04/07/22-year-old-carie-everett-made-history-as-miss-north-carolina-now-her-death-points-to-a-growing-cancer-crisis-in-young-people","2026-04-07","thegrio.com","2","687","Thegrio"
"A new study reveals there’s more than race driving breast cancer survival rate disparities in Black women - TheGrio","https://thegrio.com/2026/04/07/a-new-study-reveals-theres-more-than-race-driving-breast-cancer-survival-rate-disparities-in-black-women","2026-04-07","thegrio.com","2","734","Thegrio"
"Artemis II mission gives astronauts an unprecedented view of the moon’s far side - TheGrio","https://thegrio.com/2026/04/07/artemis-ii-moon-far-side-observation-nasa","2026-04-07","thegrio.com","2","526","Thegrio"
"Kamala Harris blasts Trump's grim threat to Iran: 'This is abhorrent' - TheGrio","https://thegrio.com/2026/04/07/kamala-harris-blasts-trumps-grim-threat-to-iran-this-is-abhorrent","2026-04-07","thegrio.com","3","596","Thegrio"
"NAACP, for the first time in its history, calls for 25th Amendment to remove Trump from office - TheGrio","https://thegrio.com/2026/04/07/naacp-calls-for-25th-amendment-to-remove-trump-for-office","2026-04-07","thegrio.com","3","745","Thegrio"
"Virginia church donates $1M to wipe out rent debt for public housing residents - TheGrio","https://thegrio.com/2026/04/07/virginia-church-1m-public-housing-rent-debt-relief","2026-04-07","thegrio.com","2","574","Thegrio"
"‘The Drama’ hits different for Black women - TheGrio","https://thegrio.com/2026/04/07/the-drama-hits-different-for-black-women","2026-04-07","thegrio.com","2","943","Thegrio"
"50 Cent documentary series greenlit at Hulu, exploring rise to global fame - TheGrio","https://thegrio.com/2026/04/08/50-cent-documentary-series-hulu-2026","2026-04-08","thegrio.com","3","461","Thegrio"
"Beyoncé's 'Lemonade' is getting the Rockabye Baby lullaby treatment ahead of its 10th anniversary - TheGrio","https://thegrio.com/2026/04/08/beyonce-lemonade-lullaby-album-10th-anniversary","2026-04-08","thegrio.com","2","442","Thegrio"
"Critics say Trump's temporary ceasefire with Iran changes nothing: 'A dangerous warmonger' - TheGrio","https://thegrio.com/2026/04/07/critics-say-trumps-temporary-ceasefire-with-iran-changes-nothing","2026-04-08","thegrio.com","1","1032","Thegrio"
"Obama Presidential Center museum ticket sales begin May 6 - TheGrio","https://thegrio.com/2026/04/08/obama-presidential-center-museum-tickets-may-2026","2026-04-08","thegrio.com","2","548","Thegrio"
"Tyler Perry’s 'Divorced Sistas' sets April return for second half of season one - TheGrio","https://thegrio.com/2026/04/08/divorced-sistas-season-1b-release-date-april-2026","2026-04-08","thegrio.com","1","466","Thegrio"
"For Laila Edwards, accolades are 'cool,' but being a role model is more important - Andscape","https://andscape.com/features/laila-edwards-usa-hockey-olympics-wisconsin-role-model-black-representation","2026-04-09","andscape.com","3","285","Andscape"
"Milwaukee Bucks vet Bobby Portis goes grassroots with AND1 sneaker deal - Andscape","https://andscape.com/features/bobby-portis-and1-sneaker-deal-milwaukee-bucks-nike-kobes-arkansas","2026-04-09","andscape.com","5","1686","Andscape"
"Nike introduces Sabrina 4 as Ionescu’s signature sneaker line grows - Andscape","https://andscape.com/features/nike-sabrina-4-sneakers-release-date","2026-04-09","andscape.com","4","574","Andscape"
"The tragedy of watching people still love Kanye West - Andscape","https://andscape.com/features/kanye-west-concerts-sofi-wireless-canceled-controversy-racism-antisemitism","2026-04-09","andscape.com","4","1674","Andscape"
"Agentic AI's governance challenges under the EU AI Act in 2026","https://www.artificialintelligence-news.com/news/agentic-ais-governance-challenges-under-the-eu-ai-act-in-2026","2026-04-09","www.artificialintelligence-news.com","2","2570","Artificialintelligence News"
"Anthropic keeps new AI model private after it finds thousands of external vulnerabilities","https://www.artificialintelligence-news.com/news/anthropic-keeps-new-ai-model-private-after-it-finds-thousands-of-external-vulnerabilities","2026-04-09","www.artificialintelligence-news.com","3","2587","Artificialintelligence News"
"Chinese researcher's death after questioning in US prompts anger in Beijing","https://ground.news/article/beijing-distressed-by-chinese-researchers-death-at-university-of-michigan","2026-04-07","ground.news","1","800","Ground News"
"'Ketamine Queen' sentenced to 15 years in Matthew Perry overdose death","https://ground.news/article/ketamine-queen-jasveen-sangha-jailed-for-15-years-over-death-of-matthew-perry","2026-04-08","ground.news","1","869","Ground News"
"Dow closes up more than 1,300 points after US-Iran ceasefire","https://ground.news/article/dow-closes-up-more-than-1-300-points-after-us-iran-ceasefire_0a45cf","2026-04-08","ground.news","1","813","Ground News"
"Hungary shared intelligence with Iran after 2024 Hezbollah pager incident","https://ground.news/article/hungary-shared-intelligence-with-iran-after-2024-hezbollah-pager-incident","2026-04-08","ground.news","1","759","Ground News"
"Iran accuses US of violating three clauses of 10-point framework before Islamabad talks begin","https://ground.news/article/iran-accuses-us-of-violating-three-clauses-of-10-point-framework-before-islamabad-talks-begin_588f60","2026-04-08","ground.news","1","812","Ground News"
"Israel was not informed of US-Iran ceasefire plan until late stages of discussion, was displeased: WSJ","https://ground.news/article/israel-was-not-informed-of-us-iran-ceasefire-plan-until-late-stages-of-discussion","2026-04-08","ground.news","1","719","Ground News"
"New Jersey Ends De-Facto Nuclear Power Plant Moratorium","https://ground.news/article/gov-sherrill-signs-bill-to-end-de-facto-moratorium-on-new-nuclear-plants","2026-04-08","ground.news","1","782","Ground News"
"US views of Israel, Netanyahu more negative in 2026, especially among young adults","https://ground.news/article/us-views-of-israel-netanyahu-more-negative-in-2026-especially-among-young-adults_3ef31d","2026-04-08","ground.news","1","812","Ground News"
"Artemis II Faces of Wave of Conspiracy Theories, AI Videos Ahead of Friday Splashdown","https://ground.news/article/artemis-ii-faces-of-wave-of-conspiracy-theories-ai-videos-ahead-of-friday-splashdown_1852c5","2026-04-09","ground.news","2","811","Ground News"
"Brampton man charged in shooting at Jewish-owned Toronto restaurant","https://ground.news/article/brampton-man-charged-in-shooting-at-jewish-owned-toronto-restaurant","2026-04-09","ground.news","1","883","Ground News"
"Chinese firm hired lobbyists with ties to Don Jr, then scored a win in Washington: Reuters","https://ground.news/article/chinese-firm-hired-lobbyists-with-ties-to-don-jr-then-scored-a-win-in-washington-reuters","2026-04-09","ground.news","1","565","Ground News"
"Core inflation was 3% in February, as expected, key Fed gauge shows","https://ground.news/article/core-inflation-was-3-in-february-as-expected-key-fed-gauge-shows","2026-04-09","ground.news","1","857","Ground News"
"Data Center Demand Pushes Utilities to Delay Coal Retirements and Add Gas","https://ground.news/article/states-are-struggling-to-meet-their-clean-energy-goals-data-centers-are-to-blame","2026-04-09","ground.news","3","745","Ground News"
"Disney plans to cut 1,000 jobs, WSJ reports","https://ground.news/article/disney-plans-to-cut-1-000-jobs-wsj-reports","2026-04-09","ground.news","2","691","Ground News"
"DOJ Declares Presidential Records Act Unconstitutional for Trump","https://ground.news/article/doj-declares-presidential-records-act-unconstitutional-for-trump_f8b156","2026-04-09","ground.news","2","745","Ground News"
"Earth Grew 16% Brighter at Night Since 2014, Study Finds","https://ground.news/article/earth-grew-16-brighter-at-night-since-2014-study-finds_a77e35","2026-04-09","ground.news","4","745","Ground News"
"Former NYPD officer gets 3 to 9 years in prison for throwing a cooler that caused fatal crash","https://ground.news/article/former-nypd-officer-gets-3-to-9-years-in-prison-for-throwing-a-cooler-that-caused-fatal-crash_3bd368","2026-04-09","ground.news","1","838","Ground News"
"Fraud Task Force, DOJ Prosecute Half-a-Billion Dollars in Health Care, COVID Schemes","https://ground.news/article/fraud-task-force-doj-prosecute-half-a-billion-dollars-in-health-care-covid-schemes","2026-04-09","ground.news","1","855","Ground News"
"GOP blocks Democrats’ attempt to limit Trump’s Iran war powers","https://ground.news/article/gop-blocks-democrats-attempt-to-limit-trumps-iran-war-powers","2026-04-09","ground.news","1","701","Ground News"
"Judge Orders Rapper Pooh Shiesty to Remain in Custody in Case Involving Rapper Gucci Mane’s Label","https://ground.news/article/the-justice-department-announced-the-arrest-of-a-memphis-rapper-on-suspicion-of-kidnapping-and-robbery","2026-04-09","ground.news","2","944","Ground News"
"Justice Department opens probe into NFL over subscription fees to watch games: Report","https://ground.news/article/us-justice-department-opens-probe-into-nfl-over-anticompetitive-practices-wsj-reports","2026-04-09","ground.news","1","767","Ground News"
"Netanyahu says Israel will begin 'direct negotiations' with Lebanon aimed at disarming Hezbollah","https://ground.news/article/netanyahu-israel-wants-to-start-peace-talks-with-lebanon-as-soon-as-possible","2026-04-09","ground.news","3","723","Ground News"
"New Model Suggests Dark Matter has Two Particle States","https://ground.news/article/new-model-suggests-dark-matter-has-two-particle-states_157685","2026-04-09","ground.news","1","661","Ground News"
"Parking Garage Collapses in Grays Ferry, Philadelphia; 1 Dead, Search for 2 Others Underway","https://ground.news/article/stairwell-inside-parking-garage-under-construction-collapses-in-philadelphia","2026-04-09","ground.news","1","791","Ground News"
"Prosecutors move to subpoena Tiger Woods’ prescription drug records after Florida DUI arrest","https://ground.news/article/prosecutors-move-to-subpoena-tiger-woods-prescription-drug-records-after-florida-dui-arrest","2026-04-09","ground.news","2","798","Ground News"
"Researchers Reclassify 300-Million-Year-Old Octopus Fossil as Nautiloid Relative","https://ground.news/article/researchers-reclassify-300-million-year-old-octopus-fossil-as-nautiloid-relative","2026-04-09","ground.news","1","977","Ground News"
"Sean Combs Appeals Conviction, Argues Sex-Video Recordings Are Protected Speech","https://ground.news/article/sean-combs-appeals-conviction-argues-sex-video-recordings-are-protected-speech","2026-04-09","ground.news","1","810","Ground News"
"Trump says US military to stay around Iran until Tehran complies with deal","https://ground.news/article/trump-says-us-military-to-stay-around-iran-until-tehran-complies-with-deal_a769e9","2026-04-09","ground.news","2","986","Ground News"
