"title","url","date","host","hits","words","source"
"New AI Model Diagnoses Five Brain Disease from One Blood Test","https://ground.news/article/new-ai-model-diagnoses-five-brain-disease-from-one-blood-test","2026-04-01","ground.news","2","630","Ground News"
"Private sector hiring totaled 62,000 in March, better than expected, ADP says","https://ground.news/article/private-sector-hiring-totaled-62-000-in-march-better-than-expected-adp-says","2026-04-01","ground.news","1","585","Ground News"
"Qubits Needed to Crack Encryption Fall 200-Fold in Under a Year","https://ground.news/article/qubits-needed-to-crack-encryption-fall-200-fold-in-under-a-year_fa31f8","2026-04-01","ground.news","2","763","Ground News"
"SpaceX Confidentially Files to Go Public, Setting Up What Could Be the Largest IPO of All Time","https://ground.news/article/spacex-files-to-go-public-setting-up-what-could-be-the-largest-ipo-of-all-time","2026-04-01","ground.news","3","574","Ground News"
"Suspected North Korean Hackers Compromise Axios Package in Supply-Chain Attack","https://ground.news/article/suspected-north-korean-hackers-compromise-axios-package-in-supply-chain-attack","2026-04-01","ground.news","2","776","Ground News"
"Taylor Swift Sued by Vegas Performer for Trademark Infringement over ""The Life of a Showgirl""","https://ground.news/article/taylor-swift-sued-by-vegas-performer-for-trademark-infringement-over-the-life-of-a-showgirl","2026-04-01","ground.news","2","881","Ground News"
"Tennessee librarian fired for refusing to move LGBTQ books from children’s to adult section","https://ground.news/article/rutherford-county-library-director-could-face-disciplinary-action-over-lgbtqia-book-stance_a4502a","2026-04-01","ground.news","1","660","Ground News"
"Trump says he is strongly considering pulling out of NATO","https://ground.news/article/f69d0362-e2a6-4519-a470-beb8fffa0815","2026-04-01","ground.news","2","862","Ground News"
"Trump says Iran's president asked for ceasefire, but U.S. wants Hormuz Strait open first","https://ground.news/article/trump-says-irans-president-asked-for-ceasefire-but-us-wants-hormuz-strait-open-first_c3be66","2026-04-01","ground.news","2","819","Ground News"
"Two-thirds of Americans want quick end to Iran war even if goals unachieved, Reuters/Ipsos poll finds","https://ground.news/article/two-in-three-americans-want-a-quick-end-to-the-iran-war","2026-04-01","ground.news","2","815","Ground News"
"US Journalist Shelly Kittleson Kidnapped in Iraq","https://ground.news/article/us-journalist-shelly-kittleson-kidnapped-in-iraq","2026-04-01","ground.news","1","839","Ground News"
"US strips citizenship from couple in trade theft case, part of Trump immigration push","https://ground.news/article/judge-revokes-us-citizenship-of-chinese-couple","2026-04-01","ground.news","2","921","Ground News"
"Most Californians still disapprove of immigration crackdown, poll says - Los Angeles Times","https://www.latimes.com/politics/story/2026-04-01/most-californians-still-disapprove-of-immigration-crackdown-poll-says","2026-04-01","www.latimes.com","2","1329","LATimes Politics"
"Black Women Built Lanes, Now Those Lanes Are Under Attack","https://newsone.com/6854578/black-women-entrepreneurship-under-attack","2026-03-31","newsone.com","3","1499","Newsone"
"Bullet That Killed Charlie Kirk Doesn't Match Rifle At Scene","https://newsone.com/6854605/charlie-kirk-bullet-doesnt-match-rifle-tyler-robinson","2026-03-31","newsone.com","3","749","Newsone"
"‘God Squad’ Removes Gulf Of Mexico Endangered Species Protections","https://newsone.com/6854613/god-squad-removes-endangered-species-protections-in-gulf-of-mexico","2026-03-31","newsone.com","4","951","Newsone"
"Gov. Gavin Newsom Signs Executive Order Regulating AI","https://newsone.com/6854734/gavin-newsom-signs-executive-order-regulating-ai","2026-04-01","newsone.com","5","910","Newsone"
"Ron DeSantis Signs Bill To Rename Florida Airport After Trump","https://newsone.com/6854638/ron-desantis-signs-bill-to-rename-florida-airport-after-trump","2026-04-01","newsone.com","3","855","Newsone"
"Trump Attends Supreme Court Birthright Citizenship Hearing","https://newsone.com/6854665/donald-trump-attends-supreme-court-birthright-citizenship-hearing","2026-04-01","newsone.com","3","1197","Newsone"
"'Incredible time': Regina Hall reveals the heartbreak that let her to nearly becoming a nun and what she learned from it - TheGrio","https://thegrio.com/2026/03/31/regina-hall-reveals-how-she-nearly-became-a-nun","2026-03-31","thegrio.com","1","491","Thegrio"
"As future of Kentucky State University seems secure, students are pushing back on potential changes - TheGrio","https://thegrio.com/2026/03/31/kentucky-state-university-senate-bill-185-reaction","2026-03-31","thegrio.com","4","564","Thegrio"
"Jemele Hill says TLC's Chilli's MAGA donations don't 'align' with her core fan base: Black women - TheGrio","https://thegrio.com/2026/03/31/jemele-hill-says-tlcs-chillis-maga-donations-doesnt-align-with-her-core-fanbase-black-women","2026-03-31","thegrio.com","2","596","Thegrio"
"Jordyn Woods has taken over social media with her bachelorette party, and we couldn’t be more grateful - TheGrio","https://thegrio.com/2026/03/31/jordyn-woods-has-taken-over-social-media-with-her-bachelorette-party-and-we-couldnt-be-more-grateful","2026-03-31","thegrio.com","3","851","Thegrio"
"Olandria Carthen is learning to ‘live in the moment’ — and she wants you to do the same - TheGrio","https://thegrio.com/2026/03/31/olandria-carthen-is-learning-to-live-in-the-moment-and-she-wants-you-to-do-the-same","2026-03-31","thegrio.com","1","869","Thegrio"
"What Black Americans should know about Democrats and Republicans and the 'Party of the KKK' - TheGrio","https://thegrio.com/2026/03/31/what-black-americans-must-know-democrats-republicans-party-of-the-kkk","2026-03-31","thegrio.com","4","1545","Thegrio"
"What exactly is going on with Ciara from 'Summer House'? - TheGrio","https://thegrio.com/2026/03/31/what-exactly-is-going-on-with-ciara-from-summer-house","2026-03-31","thegrio.com","2","1160","Thegrio"
"‘It’s not about competition’ Cardi B gets real about building her business and chasing respect - TheGrio","https://thegrio.com/2026/03/31/its-not-about-competition-cardi-b-gets-real-about-building-her-business-and-chasing-respect","2026-03-31","thegrio.com","1","628","Thegrio"
"'I was a child. And he was an adult': Brandy opens up about a past relationship that haunted her as a teen, one where the 'silence ends here' - TheGrio","https://thegrio.com/2026/03/31/brandy-wanya-morris-relationship-phases-memoir","2026-04-01","thegrio.com","2","658","Thegrio"
"As DEI backpedaling continues, Solidcore CEO wants it to be the ‘de facto landing spot for Black women’ - TheGrio","https://thegrio.com/2026/04/01/solidcore-ceo-wants-it-to-be-the-de-facto-landing-spot-for-black-women","2026-04-01","thegrio.com","2","1793","Thegrio"
"As the only Black woman on the Supreme Court, Ketanji Brown Jackson's lone dissent in conversion therapy ruling stands out - TheGrio","https://thegrio.com/2026/04/01/ketanji-brown-jackson-lone-black-woman-dissent-conversion-therapy","2026-04-01","thegrio.com","3","934","Thegrio"
"Copyright lawsuit over 'Enough (Miami)' dismissed in legal victory for Cardi B - TheGrio","https://thegrio.com/2026/04/01/cardi-b-enough-miami-lawsuit-dismissed","2026-04-01","thegrio.com","1","455","Thegrio"
"Lizzo opens up about waiting until after her Grammy win to lose her virginity - TheGrio","https://thegrio.com/2026/04/01/lizzo-virginity-2020-grammys-confession","2026-04-01","thegrio.com","2","466","Thegrio"
"Megan Thee Stallion hospitalized after exiting ‘Moulin Rouge!’ performance mid-show - TheGrio","https://thegrio.com/2026/04/01/megan-thee-stallion-hospitalized-moulin-rouge-performance","2026-04-01","thegrio.com","1","431","Thegrio"
"Selena: 31 years after the Tejano singer's death, her music still resonates with Black fans - TheGrio","https://thegrio.com/2026/04/01/selena-31-years-after-the-tejano-singers-death-her-music-still-resonates-with-black-fans","2026-04-01","thegrio.com","3","1061","Thegrio"
"Tyler Perry credits Black women for his 30-year career: 'When Black women are with you, you can do anything' - TheGrio","https://thegrio.com/2026/03/31/tyler-perry-black-women-support-sherri","2026-04-01","thegrio.com","2","559","Thegrio"
"Victor Glover poised to become first Black astronaut to travel to the moon on Artemis II - TheGrio","https://thegrio.com/2026/04/01/victor-glover-poised-to-become-first-black-astronaut-to-travel-to-the-moon-on-artemis-ii","2026-04-01","thegrio.com","4","497","Thegrio"
"April's best sneaker drops: Your guide to this month's must-have releases - Andscape","https://andscape.com/features/april-sneaker-release-dates-buying-guide-nike-converse-shai-adidas","2026-04-02","andscape.com","4","1683","Andscape"
"5 best practices to secure AI systems - AI News","https://www.artificialintelligence-news.com/news/5-best-practices-to-secure-ai-systems","2026-04-02","www.artificialintelligence-news.com","2","2867","Artificialintelligence News"
"Autonomous AI systems depend on data governance","https://www.artificialintelligence-news.com/news/autonomous-ai-systems-depend-on-data-governance","2026-04-02","www.artificialintelligence-news.com","2","2319","Artificialintelligence News"
"China's Five-Year Plan details the targets for AI deployment","https://www.artificialintelligence-news.com/news/chinas-five-year-plan-details-the-targets-for-ai-deployment","2026-04-02","www.artificialintelligence-news.com","3","2451","Artificialintelligence News"
"Experian uncovers financial services' AI fraud paradox","https://www.artificialintelligence-news.com/news/experian-ai-fraud-detection-financial-services-2026","2026-04-02","www.artificialintelligence-news.com","3","2780","Artificialintelligence News"
"KiloClaw targets shadow AI with autonomous agent governance","https://www.artificialintelligence-news.com/news/kiloclaw-targets-shadow-ai-autonomous-agent-governance","2026-04-02","www.artificialintelligence-news.com","3","2564","Artificialintelligence News"
"Girl who disappeared in Arizona over 30 years ago found alive","https://ground.news/article/girl-who-disappeared-in-arizona-over-30-years-ago-found-alive","2026-04-01","ground.news","2","671","Ground News"
"Johnson, Thune announce plan to end DHS shutdown 'in the coming days'","https://ground.news/article/johnson-thune-announce-plan-to-end-dhs-shutdown-in-the-coming-days_b002ad","2026-04-01","ground.news","1","958","Ground News"
"NASA Successfully Launches Artemis II, First Crewed Lunar Mission in Over 50 Years","https://ground.news/article/977e78c2-c8d1-4bf4-a871-b48102d684b6","2026-04-01","ground.news","1","750","Ground News"
"Protests erupt in West Bank as Israel approves death penalty for Palestinians convicted of murder","https://ground.news/article/protests-erupt-in-west-bank-as-israel-approves-death-penalty-for-palestinians-convicted-of-murder","2026-04-01","ground.news","2","858","Ground News"
"Supreme Court justices appear skeptical over Trump's changes to US birthright citizenship rules","https://ground.news/article/supreme-court-justices-appear-skeptical-over-trumps-changes-to-us-birthright-citizenship-rules_075323","2026-04-01","ground.news","2","895","Ground News"
"Anger in France over Trump’s Macron dig that wife treats him ‘badly’","https://ground.news/article/anger-in-france-over-trumps-macron-dig-that-wife-treats-him-badly_ddd963","2026-04-02","ground.news","1","766","Ground News"
"Blue Owl limits withdrawals in two funds after historic surge in redemption requests","https://ground.news/article/blue-owl-limits-withdrawals-in-two-funds-after-historic-surge-in-redemption-requests","2026-04-02","ground.news","2","751","Ground News"
"Colorado court tosses Tina Peters' 9-year sentence for tampering with election equipment, orders resentencing","https://ground.news/article/af505df1-b6f7-4908-9e49-dfb249341fc2","2026-04-02","ground.news","1","779","Ground News"
"DHS scraps Noem policy requiring secretary's review of all contracts above $100,000","https://ground.news/article/dhs-scraps-noem-policy-requiring-secretarys-review-of-all-contracts-above-100-000_713963","2026-04-02","ground.news","1","662","Ground News"
"DNC and Top Democratic Leaders Sue Trump over Mail-in Voting Executive Order","https://ground.news/article/dnc-and-top-democratic-leaders-sue-trump-over-mail-in-voting-executive-order_d0a2e0","2026-04-02","ground.news","2","877","Ground News"
"FIFA Raises World Cup Final Ticket Price to $10,990","https://ground.news/article/fifa-raises-world-cup-final-ticket-price-to-10-990","2026-04-02","ground.news","2","674","Ground News"
"Judge Dismisses Lawsuit From Parents of ""Stop Cop City"" Activist Killed by Georgia State Troopers","https://ground.news/article/judge-tosses-lawsuit-filed-by-parents-of-cop-city-protester-who-was-killed-by-troopers","2026-04-02","ground.news","1","910","Ground News"
"Korean Researchers Achieve Lithium-Air Battery Breakthrough","https://ground.news/article/korean-researchers-achieve-lithium-air-battery-breakthrough_111405","2026-04-02","ground.news","2","644","Ground News"
"Lithuania to seek US help in Epstein-linked trafficking probe","https://ground.news/article/lithuania-to-seek-us-help-in-epstein-linked-trafficking-probe","2026-04-02","ground.news","1","715","Ground News"
"Man sentenced in cross burning hoax to help elect Colorado Springs’ first Black mayor","https://ground.news/article/man-sentenced-in-cross-burning-hoax-to-help-elect-colorado-springs-first-black-mayor_a31b58","2026-04-02","ground.news","2","774","Ground News"
"Nearly 40% of Americans have less than $500 in cash savings, survey shows","https://ground.news/article/nearly-40-of-americans-have-less-than-500-in-cash-savings-survey-shows","2026-04-02","ground.news","1","397","Ground News"
"Ohio State, Harvard Face Calls to Remove Wexner Name Over Epstein Ties","https://ground.news/article/universities-pressured-to-strip-names-of-epstein-associates-from-campus-buildings","2026-04-02","ground.news","1","932","Ground News"
"Pennsylvania Charges 17 in North Philadelphia Coffee Shop Drug Ring","https://ground.news/article/drug-trafficking-ring-bust-in-north-philadelphia-leads-to-17-arrests","2026-04-02","ground.news","1","785","Ground News"
"Police Release Video From Tiger Woods’ Latest Rollover Crash","https://ground.news/article/police-to-release-video-from-tiger-woods-latest-rollover-crash","2026-04-02","ground.news","1","780","Ground News"
"Quadruple amputee cornhole player acted in self-defense when shooting car passenger, lawyer says","https://ground.news/article/update-la-plata-man-charged-in-fatal-car-shooting-on-radio-station-road","2026-04-02","ground.news","2","1040","Ground News"
"Senate passes bill to partially reopen DHS, setting up House vote","https://ground.news/article/senate-passes-bill-to-partially-reopen-dhs-setting-up-house-vote","2026-04-02","ground.news","2","934","Ground News"
"State finds explosion that killed LA County deputies involved serious safety violations","https://ground.news/article/grenade-deaths-of-la-county-deputies-involved-willful-safety-violations-state-finds","2026-04-02","ground.news","1","902","Ground News"
"Tesla reports 358,000 first-quarter vehicle deliveries, down 14% from last quarter","https://ground.news/article/tesla-tsla-q1-2026-deliveries-miss-expectations-at-358-000-builds-50-000-excess-vehicles","2026-04-02","ground.news","2","660","Ground News"
"Trump admin asks court to reimpose Anthropic supply chain risk designation","https://ground.news/article/trump-admin-asks-court-to-reimpose-anthropic-supply-chain-risk-designation","2026-04-02","ground.news","2","420","Ground News"
"Trump administration prepares up to 100% pharmaceutical tariffs on some imported drugs","https://ground.news/article/no-deal-yet-trump-readies-new-tariffs-on-select-drugmakers-report-spy-nysearca","2026-04-02","ground.news","1","835","Ground News"
"Trump says 'core strategic objectives' in Iran are near completion, without providing precise timeline","https://ground.news/article/trump-says-core-strategic-objectives-in-iran-are-near-completion-without-providing-precise-timeline_8aa479","2026-04-02","ground.news","2","1021","Ground News"
"Trump says he’ll sign order to pay all DHS employees as shutdown continues","https://ground.news/article/4b947c25-6955-4cbc-8b84-916e4bc92d50","2026-04-02","ground.news","1","807","Ground News"
"Trump Says U.S. Can’t Fund Daycare, Medicaid While Fighting Wars","https://ground.news/article/trump-said-were-fighting-wars-we-cant-take-care-of-daycare-elizabeth-warren-wants-you-to-imagine-a","2026-04-02","ground.news","1","796","Ground News"
"US crude tops $110 per barrel and Wall Street tumbles after Trump vows to escalate attacks on Iran","https://ground.news/article/82b9fd41-c5da-4395-805e-240b9963abfc","2026-04-02","ground.news","2","946","Ground News"
"US embassy in Iraq warns Americans to ‘leave now’ as Middle East strikes intensify","https://ground.news/article/us-embassy-in-iraq-warns-americans-to-leave-now-as-middle-east-strikes-intensify_323950","2026-04-02","ground.news","1","779","Ground News"
"What a silly 'Latinos Por Pratt' salsa video says about L.A.'s mayor race - Los Angeles Times","https://www.latimes.com/california/story/2026-04-02/latinos-por-pratt-video-karen-basura","2026-04-02","www.latimes.com","2","1939","LATimes Politics"
"“Damn the Novel!” An author’s cry against a privileged genre","https://myafricanmagazine.com/damn-the-novel-an-authors-cry-against-a-privileged-genre-28","2026-04-02","myafricanmagazine.com","5","1521","Myafricanmagazine"
"Judge Strikes Down EO Banning Funding For NPR And PBS","https://newsone.com/6854785/judge-strikes-down-executive-order-banning-npr-pbs-funds","2026-04-01","newsone.com","3","994","Newsone"
"Kristi Noem's Husband Shown Crossdressing In Fetish Forums","https://newsone.com/6854733/kristi-noems-husband-bryon-noem-crossdressing-fetish-forums","2026-04-01","newsone.com","3","760","Newsone"
"Rebecca Pearce Youngest Person To Run For Bowie Mayor","https://newsone.com/6854755/rebecca-pearce-bowie-maryland-mayor","2026-04-01","newsone.com","3","962","Newsone"
"Trump To Provide 'Important Update' On Iran In New Address","https://newsone.com/6854692/trump-to-provide-important-update-on-iran-war","2026-04-01","newsone.com","3","1179","Newsone"
"Trump's Election Order Is Open Rebellion Against The Country","https://newsone.com/6854768/trump-election-order-open-rebellion-against-country","2026-04-01","newsone.com","3","1336","Newsone"
"EEOC: Coca-Cola Women's Retreat Unfair To Male Employees","https://newsone.com/6854796/coca-cola-women-retreat-unfair-male-employees","2026-04-02","newsone.com","3","979","Newsone"
"Penn Ordered To Provide Trump Administration 'List Of Jews'","https://newsone.com/6854772/penn-ordered-provide-trump-administration-list-jews","2026-04-02","newsone.com","2","836","Newsone"
"Trump Iran 'Update' Was All Lies And Self-Gratification","https://newsone.com/6854825/trumps-iran-update-predictably-all-lies-self-gratification-no-substance","2026-04-02","newsone.com","2","1168","Newsone"
"What We Know About Nancy Metayer Bowen's Tragic Death","https://newsone.com/6854837/nancy-metayer-bowen-tragic-death-explained","2026-04-02","newsone.com","3","1205","Newsone"
"'I couldn’t even get out of bed': TSA agent reveals hidden toll of government shutdown - TheGrio","https://thegrio.com/2026/04/01/i-couldnt-even-get-out-of-bed-tsa-agent-reveals-hidden-toll-of-government-shutdown","2026-04-01","thegrio.com","2","997","Thegrio"
"'Recipe for chaos': Trump order to create citizenship list, restrict mail-in ballots will create barriers for Black voters, critics warn - TheGrio","https://thegrio.com/2026/04/01/trump-order-citizenship-mail-in-ballots-barriers-for-black-voters","2026-04-01","thegrio.com","2","933","Thegrio"
"As Victor Glover makes history with Artemis II moon mission, a look back at other notable Black astronauts - TheGrio","https://thegrio.com/2026/04/01/victor-glover-artemis-ii-moon-mission-black-astronauts","2026-04-01","thegrio.com","3","803","Thegrio"
"Bullying doesn’t stop after high school—so why do the conversations? - TheGrio","https://thegrio.com/2026/04/01/bullying-doesnt-stop-after-high-school-so-why-do-the-conversations","2026-04-01","thegrio.com","1","669","Thegrio"
"Justice Jackson poses critical question about pregnant women as SCOTUS casts doubt on Trump's birthright citizenship case - TheGrio","https://thegrio.com/2026/04/01/justice-jackson-poses-critical-question-about-pregnant-women-as-scotus-casts-doubt-on-trumps-birthright-citizenship","2026-04-01","thegrio.com","4","846","Thegrio"
"Meagan Good says it 'broke her heart' that young Black girls might think she didn't like herself amid skin bleaching rumors - TheGrio","https://thegrio.com/2026/04/01/meagan-good-skin-bleaching-backlash-breakfast-club","2026-04-01","thegrio.com","4","708","Thegrio"
"Megan Thee Stallion says onstage health scare was a 'wake-up call': 'My body finally said enough' - TheGrio","https://thegrio.com/2026/04/01/megan-thee-stallion-says-onstage-health-scare-was-a-wake-up-call-my-body-finally-said-enough","2026-04-01","thegrio.com","2","430","Thegrio"
"Reality TV shows the reality of being the 'Black friend' and that’s why it hits so hard - TheGrio","https://thegrio.com/2026/04/01/reality-tv-shows-the-reality-of-being-the-black-friend-and-thats-why-it-hits-so-hard","2026-04-01","thegrio.com","3","743","Thegrio"
"Tyler Perry's TSA gift card donation to stand after all, according to his reps - TheGrio","https://thegrio.com/2026/04/01/tyler-perry-gift-card-donation-all-good-tsa","2026-04-01","thegrio.com","2","564","Thegrio"
"Zendaya and Law Roach surprise Black queer bride with wedding gown - TheGrio","https://thegrio.com/2026/04/01/zendaya-and-law-roach-surprise-black-queer-bride-with-wedding-gown","2026-04-01","thegrio.com","2","840","Thegrio"
"'Unthinkable loss': NYC Mayor Zohran Mamdani speaks out after 7-month-old girl killed by stray bullet - TheGrio","https://thegrio.com/2026/04/01/7-month-old-girl-killed-stray-bullet-brooklyn","2026-04-02","thegrio.com","1","528","Thegrio"
"Florida vice mayor Nancy Metayer Bowen found dead, husband arrested in domestic violence investigation - TheGrio","https://thegrio.com/2026/04/02/florida-vice-mayor-nancy-metayer-bowen-dead-husband-arrested","2026-04-02","thegrio.com","3","492","Thegrio"
"In primetime speech, Trump claims Iran war will soon end. What does that mean for high gas prices? - TheGrio","https://thegrio.com/2026/04/01/trump-claims-iran-war-will-soon-end-what-does-that-mean-for-high-gas-prices","2026-04-02","thegrio.com","2","1133","Thegrio"
"Meek Mill calls out ‘propaganda’ about his career, highlights successes, including impact on justice reform - TheGrio","https://thegrio.com/2026/04/02/meek-mill-propaganda-claims-hip-hop-industry","2026-04-02","thegrio.com","2","670","Thegrio"
"Michaela Coel’s ‘First Day on Earth’ adds Thandiwe Newton and Ncuti Gatwa to cast - TheGrio","https://thegrio.com/2026/04/02/michaela-coel-first-day-on-earth-cast-thandiwe-newton-ncuti-gatwa","2026-04-02","thegrio.com","1","406","Thegrio"
"New study explores the gaps in Black women’s experience with IVF treatment - TheGrio","https://thegrio.com/2026/04/02/new-study-explores-the-gaps-in-black-womens-experience-with-ivf-treatment","2026-04-02","thegrio.com","2","607","Thegrio"
"The 'Black recession' is here: Trump's tariffs gutted Black workers and Black-owned businesses - TheGrio","https://thegrio.com/2026/04/02/the-black-recession-is-here-trump-tariffs-black-workers-black-owned-businesses","2026-04-02","thegrio.com","4","1025","Thegrio"
"‘She was just starting to take her first steps’: Family mourns 7-month-old, Kaori Patterson-Moore, killed by stray bullet in Brooklyn - TheGrio","https://thegrio.com/2026/04/02/brooklyn-baby-stray-bullet-shooting-kaori-patterson-moore","2026-04-02","thegrio.com","1","514","Thegrio"
"Hasheem Thabeet continues career as 'role model' in Basketball Africa League - Andscape","https://andscape.com/features/hasheem-thabeet-continues-career-as-role-model-in-basketball-africa-league","2026-04-02","andscape.com","2","1906","Andscape"
"Drugmakers to face 100% tariff unless they cut prices or produce drugs in US, Trump administration says","https://ground.news/article/drugmakers-to-face-100-tariff-unless-they-cut-prices-or-produce-drugs-in-us-trump-administration-says_cf6156","2026-04-02","ground.news","2","783","Ground News"
"Hegseth asked Army Chief of Staff Gen. Randy George to step down: Report","https://ground.news/article/hegseth-asked-army-chief-of-staff-gen-randy-george-to-step-down-report_18687c","2026-04-02","ground.news","1","864","Ground News"
"Key Democrat says Bondi can’t escape Epstein files testimony","https://ground.news/article/key-democrat-says-bondi-cant-escape-epstein-files-testimony","2026-04-02","ground.news","1","772","Ground News"
"Trump’s White House ballroom gets final approval days after judge’s ruling halting construction","https://ground.news/article/trumps-white-house-ballroom-gets-final-approval-days-after-judges-ruling-halting-construction","2026-04-02","ground.news","1","935","Ground News"
"Vance anti-fraud task force suspends 221 California hospice and healthcare providers so far","https://ground.news/article/vance-anti-fraud-task-force-suspends-221-california-hospice-and-healthcare-providers-so-far_6cdd82","2026-04-02","ground.news","1","1014","Ground News"
"3 state troopers plead not guilty to charges connected to death of recruit after boxing match","https://ground.news/article/supervisor-massachusetts-state-police-academy-instructors-to-face-charges-in-trainees-death","2026-04-03","ground.news","1","754","Ground News"
